6459298549, NTY4MDI3MTEwNjo5NDgwNjc2NTM0OQ--, Houston Galleria| West University Place, smoke free rooms|fitness center|pool(s)|restaurant(s)|business center|laundry facilities|high-speed internet access, 3.5, 51.00, 14.78, 1, 65.78, 80, 3.5
6404993709, NTY4MDI3MTEwNjo5NDgwNjc2NTMwMg--, Houston Galleria| West University Place, fitness center|pool(s)|restaurant(s)|business center|high-speed internet access, 4.0, 78.00, 20.50, 1, 98.50, 90, 
5245711567, NTY4MDI3MTEwNjo5NDgwNjc2NDI5MA--, Houston Galleria| West University Place, fitness center|business center, 3.0, 51.00, 14.78, 1, 65.78, 95, 
6900300471, NTY4MDI3MTEwNjo5NDgwNjc2NDI5Ng--, Downtown Houston| Houston, fitness center|pool(s)|restaurant(s)|business center|high-speed internet access|spa services, 4.0, 94.00, 23.17, 1, 117.17, 95, 4.0
5634568043, NTY4MDI3MTEwNjo5NDgwNjc2NTM1Mg--, Houston Galleria| West University Place, laundry facilities, 2.0, 36.00, 12.31, 1, 48.31, 75, 
6165431252, NTY4MDI3MTEwNjo5NDgwNjc2NTMxMw--, Aldine - Bush Ictl Airport IAH| Humble, airport shuttle|fitness center|pool(s), 3.0, 41.00, 13.13, 1, 54.13, 95, 
6880368631, NTY4MDI3MTEwNjo5NDgwNjc2NTMwNw--, Aldine - Bush Ictl Airport IAH| Humble, smoke free rooms|airport shuttle|fitness center|pool(s)|restaurant(s)|business center|laundry facilities|high-speed internet access|golf nearby, 3.5, 56.00, 15.60, 1, 71.60, 90, 3.0
5519447738, NTY4MDI3MTEwNjo5NDgwNjc2NTM1OA--, NW Houston - Brookhollow| Spring Valley, fitness center|pool(s)|restaurant(s)|business center|laundry facilities, 3.0, 47.00, 14.16, 1, 61.16, 95, 4.0
5179724314, NTY4MDI3MTEwNjo5NDgwNjc2NTMxMQ--, Downtown Houston| Houston, fitness center|restaurant(s)|business center, 3.5, 101.00, 24.28, 1, 125.28, 85, 3.5
5049235491, NTY4MDI3MTEwNjo5NDgwNjc2NTMwNg--, NW Houston - Brookhollow| Spring Valley, fitness center|pool(s)|laundry facilities, 2.5, 35.00, 12.11, 1, 47.11, 80, 4.0
5008034737, NTY4MDI3MTEwNjo5NDgwNjc2NTM0Mw--, Houston West - Energy Corridor| Spring Valley, fitness center|pool(s)|restaurant(s)|business center|laundry facilities|high-speed internet access, 3.0, 46.00, 13.96, 1, 59.96, 95, 
6086841677, NTY4MDI3MTEwNjo5NDgwNjc2NTMyNw--, Houston Hobby Airport HOU| South Houston, pool(s)|laundry facilities, 3.0, 53.00, 15.19, 1, 68.19, 90, 
5681663475, NTY4MDI3MTEwNjo5NDgwNjc2NDI5OA--, Medical Center - Astrodome| VA Hospital, fitness center|pool(s)|restaurant(s)|business center|laundry facilities, 3.0, 72.00, 18.47, 1, 90.47, 95, 4.0
5720030571, NTY4MDI3MTEwNjo5NDgwNjc2NTMzMA--, SW Houston - Sugar Land| Sugar Land, fitness center|pool(s)|restaurant(s)|laundry facilities|golf nearby, 3.0, 41.00, 13.13, 1, 54.13, 80, 3.5
6723677423, NTY4MDI3MTEwNjo5NDgwNjc2NDI5OQ--, Medical Center - Astrodome| VA Hospital, fitness center|pool(s)|restaurant(s)|business center|high-speed internet access|golf nearby, 3.5, 86.00, 21.73, 1, 107.73, 50, 3.0
6224461612, NTY4MDI3MTEwNjo5NDgwNjc2NDMwMA--, Medical Center - Astrodome| VA Hospital, laundry facilities, 2.0, 38.00, 12.63, 1, 50.63, , 
6938194721, NTY4MDI3MTEwNjo5NDgwNjc2NTM2OA--, East Houston - Cloverleaf| Jacinto City, complimentary breakfast|pool(s)|high-speed internet access, 3.0, 48.00, 14.37, 1, 62.37, 65, 
6945548436, NTY4MDI3MTEwNjo5NDgwNjc2NTM1Ng--, NW Houston - Brookhollow| Spring Valley, suite|fitness center|kitchenette, 2.0, 32.00, 11.49, 1, 43.49, 65, 
5652547313, NTY4MDI3MTEwNjo5NDgwNjc2NTM0MA--, Channelview| Channelview, complimentary breakfast|fitness center|pool(s)|business center|laundry facilities|high-speed internet access, 3.0, 48.00, 14.37, 1, 62.37, 90, 4.0
6224571261, NTY4MDI3MTEwNjo5NDgwNjc2NTMxNA--, Houston West - Energy Corridor| Spring Valley, laundry facilities, 2.0, 32.00, 11.49, 1, 43.49, , 
6569303481, NTY4MDI3MTEwNjo5NDgwNjc2NTMzOA--, SW Houston - Sugar Land| Sugar Land, complimentary breakfast|pool(s)|laundry facilities|high-speed internet access, 2.5, 39.00, 12.72, 1, 51.72, 75, 3.5
6121205297, NTY4MDI3MTEwNjo5NDgwNjc2NTMzMg--, Aldine - Bush Ictl Airport IAH| Humble, pool(s)|laundry facilities, 2.0, 30.00, 11.29, 1, 41.29, 45, 
6088145892, NTY4MDI3MTEwNjo5NDgwNjc2NTM2MQ--, Willowbrook - Cypress Station| North Houston, laundry facilities, 2.0, 29.00, 11.08, 1, 40.08, 85, 
6584943302, NTY4MDI3MTEwNjo5NDgwNjc2NTMyMQ--, Aldine - Bush Ictl Airport IAH| Humble, , 2.5, 47.00, 14.16, 1, 61.16, , 
5811790461, NTY4MDI3MTEwNjo5NDgwNjc2NTM1MQ--, East Houston - Cloverleaf| Jacinto City, complimentary breakfast|fitness center|pool(s)|business center|laundry facilities|high-speed internet access, 2.5, 48.00, 14.37, 1, 62.37, , 4.0
6852245570, NTY4MDI3MTEwNjo5NDgwNjc2NTMxNg--, SW Houston - Sugar Land| Sugar Land, high-speed internet access, 2.0, 33.00, 11.68, 1, 44.68, 65, 
5044070509, NTY4MDI3MTEwNjo5NDgwNjc2NDI4NA--, East Houston - Cloverleaf| Jacinto City, complimentary breakfast|pool(s)|high-speed internet access, 2.0, 39.00, 12.72, 1, 51.72, , 2.5
6109632493, NTY4MDI3MTEwNjo5NDgwNjc2NTM1MA--, Baytown| Baytown, complimentary breakfast|fitness center|pool(s)|laundry facilities, 3.0, 42.00, 13.54, 1, 55.54, 80, 3.5
5605946850, NTY4MDI3MTEwNjo5NDgwNjc2NTM0MQ--, Houston West - Energy Corridor| Spring Valley, fitness center|pool(s)|restaurant(s)|business center|high-speed internet access|tennis nearby, 4.0, 140.00, 31.05, 1, 171.05, 90, 4.0
5547818406, NTY4MDI3MTEwNjo5NDgwNjc2NTMwNA--, Houston Hobby Airport HOU| South Houston, , 2.0, 37.00, 14.66, 1, 51.66, 35, 
5413622567, NTY4MDI3MTEwNjo5NDgwNjc2NTMzMw--, SW Houston - Sugar Land| Sugar Land, suite|smoke free rooms|fitness center|pool(s)|high-speed internet access, 3.5, 92.00, 22.86, 1, 114.86, 90, 4.5
5129958728, NTY4MDI3MTEwNjo5NDgwNjc2NTMzNA--, Washington Ave| Houston, complimentary breakfast, 2.0, 57.00, 15.88, 1, 72.88, , 2.5
6186707464, NTY4MDI3MTEwNjo5NDgwNjc2NTMzNg--, Clear Lake - NASA Space Center - Kemah| Nassau Bay, pool(s)|restaurant(s), 3.0, 54.00, 15.75, 1, 69.75, 95, 
6348689555, NTY4MDI3MTEwNjo5NDgwNjc2NTMzNQ--, Cyfair| Jersey Village, complimentary breakfast|pool(s)|laundry facilities|high-speed internet access, 2.5, 39.00, 12.36, 1, 51.36, 80, 3.5
5096504441, NTY4MDI3MTEwNjo5NDgwNjc2NDI5Mw--, Pasadena| Pasadena, fitness center|business center|laundry facilities|high-speed internet access, 3.0, 72.00, 18.47, 1, 90.47, , 3.5
6519068350, NTY4MDI3MTEwNjo5NDgwNjc2NTMxNQ--, Clear Lake - NASA Space Center - Kemah| Nassau Bay, laundry facilities, 2.0, 34.00, 11.90, 1, 45.90, 75, 3.5
6428537562, NTY4MDI3MTEwNjo5NDgwNjc2NTM2Nw--, Baytown| Baytown, complimentary breakfast|pool(s)|laundry facilities|high-speed internet access, 2.5, 39.00, 12.72, 1, 51.72, 70, 3.5
5944606848, NTY4MDI3MTEwNjo5NDgwNjc2NTM2NQ--, Willowbrook - Cypress Station| North Houston, fitness center|pool(s)|restaurant(s)|business center|laundry facilities|high-speed internet access|tennis nearby, 2.5, 59.00, 15.12, 1, 74.12, 100, 4.0
5214184462, NTY4MDI3MTEwNjo5NDgwNjc2NDI5Mg--, Pasadena| Pasadena, complimentary breakfast|pool(s)|restaurant(s)|business center|laundry facilities|high-speed internet access, 2.5, 67.00, 17.50, 1, 84.50, , 4.0
5117530772, NTY4MDI3MTEwNjo5NDgwNjc2NTMyOQ--, La Porte| La Porte, high-speed internet access, 2.0, 36.00, 12.31, 1, 48.31, , 
5877329130, NTY4MDI3MTEwNjo5NDgwNjc2NTM0Mg--, Channelview| Channelview, complimentary breakfast, 2.0, 45.00, 13.70, 1, 58.70, , 4.0
5427667481, NTY4MDI3MTEwNjo5NDgwNjc2NTM0NA--, Atascocita| Atascocita, high-speed internet access, 3.0, 70.00, 15.46, 1, 85.46, , 
5876259006, NTY4MDI3MTEwNjo5NDgwNjc2NTMyOA--, Pearland| Pearland, complimentary breakfast|high-speed internet access, 2.5, 72.00, 15.79, 1, 87.79, , 
5897062294, NTY4MDI3MTEwNjo5NDgwNjc2NTM2Mw--, Deer Park| Deer Park, complimentary breakfast, 2.0, 43.00, 13.42, 1, 56.42, , 4.0
5346035729, NTY4MDI3MTEwNjo5NDgwNjc2NTMwOQ--, Houston West - Energy Corridor| Spring Valley, complimentary breakfast|high-speed internet access, 1.0, 36.00, 12.19, 1, 48.19, , 3.5
5570476803, NTY4MDI3MTEwNjo5NDgwNjc2NTM1NA--, Deer Park| Deer Park, complimentary breakfast|fitness center|pool(s)|business center|laundry facilities|high-speed internet access, 3.0, 83.00, 21.32, 1, 104.32, , 3.5
5868418381, NTY4MDI3MTEwNjo5NDgwNjc2NDI5NQ--, Pasadena| Pasadena, complimentary breakfast|pool(s)|high-speed internet access, 2.0, 63.00, 13.40, 1, 76.40, , 3.5
6129732646, NTY4MDI3MTEwNjo5NDgwNjc2NTMyNg--, League City - Dickinson| League City, complimentary breakfast|high-speed internet access, 2.0, 37.00, 11.01, 1, 48.01, , 3.5
5537659398, NTY4MDI3MTEwNjo5NDgwNjc2NDI4Nw--, Alvin| Alvin, fitness center|pool(s)|business center|high-speed internet access, 2.5, 52.00, 12.60, 1, 64.60, , 4.5
6598574636, NTY4MDI3MTEwNjo5NDgwNjc2NTM2MA--, Baytown| Baytown, complimentary breakfast|business center|laundry facilities, 2.0, 41.00, 13.09, 1, 54.09, , 
6117541054, NTY4MDI3MTEwNjo5NDgwNjc2NTMyMA--, Aldine - Bush Ictl Airport IAH| Humble, airport shuttle|complimentary breakfast|high-speed internet access, 1.0, 41.00, 13.04, 1, 54.04, , 3.5
6726240936, NTY4MDI3MTEwNjo5NDgwNjc2NDI4Ng--, Alvin| Alvin, high-speed internet access, 2.0, 59.00, 13.47, 1, 72.47, , 
6262247266, NTY4MDI3MTEwNjo5NDgwNjc2NTMwOA--, Channelview| Channelview, high-speed internet access, 1.0, 47.00, 13.63, 1, 60.63, , 0.0
6034920265, NTY4MDI3MTEwNjo5NDgwNjc2NDI4Mg--, Alvin| Alvin, complimentary breakfast, 1.0, 38.00, 11.20, 1, 49.20, , 2.5
6887244936, NTY4MDI2OTg5MTo5NDgwNjc4NjQ5OQ--, Downtown Toronto East| Toronto, suite|fitness center|restaurant(s)|business center|high-speed internet access, 4.0, 91.00, 19.27, 1, 110.27, 90, 4.0
5065429413, NTY4MDI2OTg5MTo5NDgwNjc4NjQ4MQ--, Downtown Toronto West| Toronto, fitness center|pool(s)|restaurant(s)|business center|high-speed internet access, 4.0, 99.00, 20.88, 1, 119.88, 90, 
5486816310, NTY4MDI2OTg5MTo5NDgwNjc4NjQ4Mg--, Downtown Toronto East| Toronto, smoke free rooms|fitness center|pool(s)|restaurant(s)|business center|high-speed internet access, 3.5, 85.00, 18.46, 1, 103.46, 80, 3.5
6116029793, NTY4MDI2OTg5MTo5NDgwNjc4OTg1Mg--, Downtown Toronto West| Toronto, boutique hotel|restaurant(s), 3.0, 73.00, 16.84, 1, 89.84, 65, 3.5
5766024479, NTY4MDI2OTg5MTo5NDgwNjc4NjQ5OA--, Downtown Toronto West| Toronto, fitness center|pool(s)|restaurant(s)|business center|high-speed internet access, 3.5, 95.00, 19.75, 1, 114.75, 65, 3.0
5129834368, NTY4MDI2OTg5MTo5NDgwNjc4NjQ3OQ--, Downtown Toronto East| Toronto, complimentary breakfast|fitness center|business center|laundry facilities|high-speed internet access, 2.5, 54.00, 13.33, 1, 67.33, 45, 3.5
6107252533, NTY4MDI2OTg5MTo5NDgwNjc4NjQ4Mw--, Downtown Toronto East| Toronto, complimentary breakfast, 2.0, 55.00, 13.42, 1, 68.42, 65, 2.5
6001904715, NTY4MDI2OTg5MTo5NDgwNjc4NjQ4NQ--, Downtown Toronto West| Toronto, complimentary breakfast, 2.0, 67.00, 15.71, 1, 82.71, , 
5291465957, NTY4MDI2OTg5MTo5NDgwNjc4NjQ5MA--, Lester B. Pearson Intl Airport YYZ| Etobicoke, airport shuttle|restaurant(s)|high-speed internet access, 2.5, 40.00, 13.64, 1, 53.64, 90, 
5175116028, NTY4MDI2OTg5MTo5NDgwNjc4NjQ4NA--, Lester B. Pearson Intl Airport YYZ| Etobicoke, airport shuttle|fitness center|pool(s)|restaurant(s)|business center|high-speed internet access|spa services, 3.5, 63.00, 14.55, 1, 77.55, 85, 3.5
5272781315, NTY4MDI2OTg5MTo5NDgwNjc4NjQ4Nw--, Don Valley| North York, fitness center|pool(s)|restaurant(s)|business center|high-speed internet access, 3.0, 61.00, 14.23, 1, 75.23, 75, 3.0
5174475813, NTY4MDI2OTg5MTo5NDgwNjc4NjQ5MQ--, Lester B. Pearson Intl Airport YYZ| Etobicoke, smoke free rooms|airport shuttle|fitness center|pool(s)|restaurant(s)|business center|high-speed internet access, 3.0, 50.00, 12.77, 1, 62.77, 70, 3.0
6592892839, NTY4MDI2OTg5MTo5NDgwNjc4NjQ5Ng--, Lester B. Pearson Intl Airport YYZ| Etobicoke, airport shuttle|fitness center|restaurant(s)|business center|high-speed internet access, 4.0, 109.00, 21.69, 1, 130.69, 90, 
6105435311, NTY4MDI2OTg5MTo5NDgwNjc4NjQ4MA--, North York - Vaughan| North York, airport shuttle|pool(s)|restaurant(s), 2.5, 56.00, 13.56, 1, 69.56, 40, 3.0
5013612647, NTY4MDI2OTg5MTo5NDgwNjc4NjQ5Nw--, North York - Vaughan| North York, complimentary breakfast|business center|laundry facilities|high-speed internet access, 2.0, 51.00, 12.94, 1, 63.94, 95, 3.5
5141339937, NTY4MDI2OTg5MTo5NDgwNjc4NjQ5NQ--, North York - Vaughan| North York, fitness center|pool(s)|restaurant(s)|business center|high-speed internet access, 3.0, 85.00, 18.46, 1, 103.46, 90, 3.5
5384554613, NTY4MDI2OTg5MTo5NDgwNjc4NjQ5Mg--, Toronto East| Scarborough, complimentary breakfast|high-speed internet access, 2.0, 60.00, 14.07, 1, 74.07, , 
6121626278, NTY4MDI2OTg5MTo5NDgwNjc4NjQ4OA--, Lester B. Pearson Intl Airport YYZ| Etobicoke, complimentary breakfast|high-speed internet access, 2.0, 55.00, 14.01, 1, 69.01, 40, 2.5
6793051263, NTY4MDI2OTg5MTo5NDgwNjc4NjUwMA--, North York - Vaughan| North York, pool(s)|restaurant(s)|tennis nearby, 1.0, 81.00, 17.92, 1, 98.92, , 3.0
6406248898, NTY4MDI2OTg5Njo5NDgwNjgwNDUyNA--, Midtown Central| New York City, smoke free rooms|fitness center|high-speed internet access, 4.0, 153.00, 39.21, 1, 192.21, 80, 4.0
6658408579, NTY4MDI2OTg5Njo5NDgwNjgwNDUyNg--, Midtown Central| New York City, fitness center|business center|laundry facilities|high-speed internet access|kitchenette, 3.0, 119.00, 30.98, 1, 149.97, 80, 4.0
5198580669, NTY4MDI2OTg5Njo5NDgwNjgwNTM1Mg--, Empire State Building| New York City, fitness center|restaurant(s)|business center|high-speed internet access, 4.0, 162.00, 40.62, 1, 202.61, 80, 4.0
6312541926, NTY4MDI2OTg5Njo5NDgwNjgwNDU0OQ--, Downtown - SoHo - Financial District| New York City, restaurant(s)|business center|high-speed internet access, 3.5, 120.00, 31.16, 1, 151.16, , 4.0
6804458928, NTY4MDI2OTg5Njo5NDgwNjgwNTM2Mw--, Times Square - Theatre District| New York City, fitness center|business center|high-speed internet access, 2.5, 95.00, 27.17, 1, 122.18, , 
6531677488, NTY4MDI2OTg5Njo5NDgwNjgwNTM1NQ--, Downtown - SoHo - Financial District| New York City, fitness center|restaurant(s)|business center|high-speed internet access, 4.0, 174.00, 42.57, 1, 216.57, 95, 4.0
5954761733, NTY4MDI2OTg5Njo5NDgwNjgwNDUyMA--, Midtown Central| New York City, restaurant(s)|business center|high-speed internet access, 3.5, 167.00, 41.44, 1, 208.44, 85, 
5183394930, NTY4MDI2OTg5Njo5NDgwNjgwNDUzOA--, Central Park| New York City, boutique hotel|fitness center|restaurant(s)|high-speed internet access, 4.0, 149.00, 38.51, 1, 187.51, 80, 
5445746141, NTY4MDI2OTg5Njo5NDgwNjgwNDUyNw--, Midtown East| New York City, suite|fitness center|restaurant(s)|high-speed internet access|kitchenette, 3.0, 119.00, 30.96, 1, 149.96, 75, 
5251921426, NTY4MDI2OTg5Njo5NDgwNjgwNTM2Mg--, Central Park| New York City, laundry facilities|high-speed internet access, 2.5, 73.00, 23.66, 1, 96.66, 50, 
5333350228, NTY4MDI2OTg5Njo5NDgwNjgwNDU0Mg--, Central Park| New York City, smoke free rooms|fitness center|high-speed internet access, 3.0, 102.00, 28.20, 1, 130.21, 90, 4.0
5910523922, NTY4MDI2OTg5Njo5NDgwNjgwNTM1Ng--, Empire State Building| New York City, suite|fitness center|laundry facilities|kitchenette, 3.0, 120.00, 31.14, 1, 151.14, 75, 3.5
6105288677, NTY4MDI2OTg5Njo5NDgwNjgwNDUxMQ--, Central Park| New York City, boutique hotel, 2.0, 68.00, 21.57, 1, 89.57, , 3.0
5526060381, NTY4MDI2OTg5Njo5NDgwNjgwNTM2Nw--, Times Square - Theatre District| New York City, fitness center|restaurant(s)|high-speed internet access, 3.0, 153.00, 39.17, 1, 192.17, 65, 3.5
5509173531, NTY4MDI2OTg5Njo5NDgwNjgwNTM2NQ--, Downtown - SoHo - Financial District| New York City, high-speed internet access, 2.0, 89.00, 26.10, 1, 115.10, , 3.5
5879790410, NTY4MDI2OTg5Njo5NDgwNjgwNTM2OA--, Downtown - SoHo - Financial District| New York City, high-speed internet access, 3.0, 142.00, 32.64, 1, 174.64, 50, 4.0
5320851413, NTY4MDI2OTg5Njo5NDgwNjgwNTM2MQ--, Times Square - Theatre District| New York City, restaurant(s), 2.0, 113.00, 29.99, 1, 142.99, 60, 4.0
6297951853, NTY4MDI2OTg5Njo5NDgwNjgwNDUxMA--, Midtown Central| New York City, complimentary breakfast, 2.0, 113.00, 29.98, 1, 142.98, , 
5784276549, NTY4MDI2OTg5Njo5NDgwNjgwNDUyNQ--, Midtown East| New York City, smoke free rooms|complimentary breakfast|restaurant(s)|laundry facilities|high-speed internet access, 2.5, 132.00, 33.06, 1, 165.06, , 4.5
5140639079, NTY4MDI2OTg5Njo5NDgwNjgwNDUzMQ--, Central Park| New York City, condo|studio|fully-equipped kitchen|air conditioning|fitness center|laundry facilities|high-speed internet access, 2.5, 108.00, 29.17, 1, 137.17, 50, 3.5
6766761080, NTY4MDI2OTg5Njo5NDgwNjgwNTM1MQ--, LaGuardia Airport LGA - Flushing| Corona, airport shuttle|fitness center|pool(s)|restaurant(s)|business center|high-speed internet access, 3.0, 89.00, 26.11, 1, 115.11, 75, 3.5
6606596987, NTY4MDI2OTg5Njo5NDgwNjgwNDUxNw--, Newark Intl Airport EWR| Elizabeth, airport shuttle|fitness center|restaurant(s)|business center|laundry facilities|high-speed internet access, 2.0, 34.00, 10.97, 1, 44.97, , 
5227892506, NTY4MDI2OTg5Njo5NDgwNjgwNDU0Mw--, LaGuardia Airport LGA - Flushing| Corona, airport shuttle|fitness center|restaurant(s)|high-speed internet access, 2.5, 81.00, 24.81, 1, 105.82, 65, 3.0
6583634124, NTY4MDI2OTg5Njo5NDgwNjgwNDUyOA--, John F. Kennedy Intl Airport JFK - Jamaica| John F Kennedy Airport, complimentary breakfast|fitness center|business center, 2.5, 63.00, 23.21, 1, 86.21, , 3.5
6043358292, NTY4MDI2OTg5Njo5NDgwNjgwNDUzMA--, John F. Kennedy Intl Airport JFK - Jamaica| John F Kennedy Airport, complimentary breakfast|fitness center|business center|laundry facilities|high-speed internet access, 3.0, 84.00, 25.04, 1, 109.04, 60, 
6471905943, NTY4MDI2OTg5Njo5NDgwNjgwNDUzMw--, John F. Kennedy Intl Airport JFK - Jamaica| John F Kennedy Airport, airport shuttle|complimentary breakfast|business center|high-speed internet access, 2.0, 62.00, 20.59, 1, 82.59, 70, 3.5
5527853112, NTY4MDI2OTg5Njo5NDgwNjgwNDU0NQ--, LaGuardia Airport LGA - Flushing| Corona, complimentary breakfast|high-speed internet access, 2.0, 81.00, 24.89, 1, 105.89, , 3.5
6400511663, NTY4MDI2OTg5Njo5NDgwNjgwNDUxNg--, Newark Intl Airport EWR| Elizabeth, airport shuttle|fitness center|pool(s)|restaurant(s)|high-speed internet access, 3.0, 76.00, 20.37, 1, 96.37, 75, 
6700763577, NTY4MDI2OTg5Njo5NDgwNjgwNDUxMg--, Newark Intl Airport EWR| Elizabeth, airport shuttle|fitness center|high-speed internet access, 2.5, 63.00, 16.78, 1, 79.78, , 
6185757308, NTY4MDI2OTg5Njo5NDgwNjgwNDUzNA--, John F. Kennedy Intl Airport JFK - Jamaica| John F Kennedy Airport, smoke free rooms|airport shuttle|fitness center|restaurant(s)|business center|high-speed internet access, 3.5, 149.00, 38.51, 1, 187.51, , 
5939403633, NTY4MDI2OTg5Njo5NDgwNjgwNTM1Mw--, LaGuardia Airport LGA - Flushing| Corona, complimentary breakfast|high-speed internet access, 1.0, 72.00, 22.21, 1, 94.21, , 
5321549019, NTY4MDI2OTg5Njo5NDgwNjgwNDUxNA--, Newark Intl Airport EWR| Elizabeth, airport shuttle|fitness center|restaurant(s)|business center|high-speed internet access, 3.5, 161.00, 35.83, 1, 196.83, , 
6820131534, NTY4MDI3MDMzNDo5NDgwNjgxNDk5NA--, LA Intl Airport LAX| Westchester, fitness center|pool(s)|restaurant(s)|business center|laundry facilities|high-speed internet access, 3.0, 48.00, 13.10, 1, 61.10, , 
6108428663, NTY4MDI3MDMzNDo5NDgwNjgxNDk3MQ--, Downtown Los Angeles| Los Angeles, fitness center|restaurant(s)|business center|high-speed internet access, 3.5, 82.00, 18.98, 1, 100.98, , 
5556936842, NTY4MDI3MDMzNDo5NDgwNjgxNDk2NA--, Chinatown| Los Angeles, airport shuttle|fitness center|business center|high-speed internet access, 2.5, 58.00, 14.40, 1, 72.40, , 
5890677505, NTY4MDI3MDMzNDo5NDgwNjgxNDk3NQ--, Downtown Los Angeles| Los Angeles, fitness center|restaurant(s)|business center|laundry facilities|high-speed internet access|spa services, 3.0, 79.00, 18.52, 1, 97.52, , 
5475637281, NTY4MDI3MDMzNDo5NDgwNjgxNDk1MQ--, Hollywood| Hollywood, complimentary breakfast|pool(s), 2.0, 45.00, 12.51, 1, 57.51, , 
6698151796, NTY4MDI3MDMzNDo5NDgwNjgxNDk2NQ--, Pasadena| Pasadena, fitness center|pool(s)|restaurant(s)|business center|high-speed internet access, 3.5, 78.00, 19.16, 1, 97.16, , 
5387954819, NTY4MDI3MDMzNDo5NDgwNjgxNDk3OA--, Beverly Hills - West Hollywood| Beverly Hills, fitness center|pool(s)|restaurant(s)|business center|high-speed internet access|spa services, 4.5, 180.00, 37.79, 1, 217.79, , 
6223186675, NTY4MDI3MDMzNDo5NDgwNjgxNDk5Ng--, LA Intl Airport LAX| Westchester, airport shuttle|fitness center|pool(s)|restaurant(s)|high-speed internet access, 3.5, 75.00, 17.92, 1, 92.92, , 
6089444979, NTY4MDI3MDMzNDo5NDgwNjgxNDk5Mg--, LA Intl Airport LAX| Westchester, airport shuttle|fitness center|pool(s)|laundry facilities|high-speed internet access, 2.5, 48.00, 13.95, 1, 61.95, , 
6509012761, NTY4MDI3MDMzNDo5NDgwNjgxNDk5Nw--, Pasadena| Pasadena, smoke free rooms|fitness center|pool(s)|restaurant(s)|business center|high-speed internet access|tennis nearby|spa services, 5.0, 162.00, 34.40, 1, 196.40, , 
5131355621, NTY4MDI3MDMzNDo5NDgwNjgxNDk4Nw--, LA Intl Airport LAX| Westchester, airport shuttle|pool(s)|laundry facilities, 2.0, 38.00, 10.80, 1, 48.80, , 
5374853712, NTY4MDI3MDMzNDo5NDgwNjgxMzM5MQ--, Glendale - Burbank - Universal City| Burbank, smoke free rooms|fitness center|pool(s)|restaurant(s)|business center|high-speed internet access, 4.0, 118.00, 24.17, 1, 142.17, , 
5621524397, NTY4MDI3MDMzNDo5NDgwNjgxMzM4OA--, Culver City| Culver City, airport shuttle|fitness center|pool(s)|restaurant(s)|business center|laundry facilities|high-speed internet access, 3.0, 63.00, 13.99, 1, 76.99, , 
5298581131, NTY4MDI3MDMzNDo5NDgwNjgxMzQwMA--, Downey - Commerce - Norwalk| Downey, pool(s), 2.0, 39.00, 10.21, 1, 49.21, , 
5201111859, NTY4MDI3MDMzNDo5NDgwNjgxNDk4Ng--, Century City - Westwood| Century City, fitness center|pool(s)|restaurant(s)|business center|high-speed internet access|golf nearby|tennis nearby, 4.0, 126.00, 25.61, 1, 151.61, , 
5411693157, NTY4MDI3MDMzNDo5NDgwNjgxNDk2MA--, Glendale - Burbank - Universal City| Burbank, fitness center|pool(s)|restaurant(s)|laundry facilities, 3.5, 96.00, 21.23, 1, 117.23, , 
6329964761, NTY4MDI3MDMzNDo5NDgwNjgxMzM5Mw--, Hollywood| Hollywood, smoke free rooms|fitness center, 3.0, 99.00, 21.36, 1, 120.36, , 
6459350887, NTY4MDI3MDMzNDo5NDgwNjgxNDk3Nw--, Pasadena| Pasadena, complimentary breakfast|pool(s)|laundry facilities|high-speed internet access, 2.0, 48.00, 13.47, 1, 61.47, , 
6344852382, NTY4MDI3MDMzNDo5NDgwNjgxNDk4MA--, Beverly Hills - West Hollywood| Beverly Hills, boutique hotel|smoke free rooms|fitness center|pool(s)|restaurant(s), 4.0, 150.00, 31.06, 1, 181.06, , 
5724959823, NTY4MDI3MDMzNDo5NDgwNjgxNDk4OA--, Huntington Park - South Gate| Huntington Park, smoke free rooms|complimentary breakfast|restaurant(s)|business center|laundry facilities|high-speed internet access, 2.0, 48.00, 13.84, 1, 61.84, , 
5923987752, NTY4MDI3MDMzNDo5NDgwNjgxNDk2Ng--, Mid-Wilshire - Westlake - USC| Los Angeles, fitness center|pool(s)|restaurant(s)|business center|laundry facilities|high-speed internet access|golf nearby|tennis nearby, 2.5, 71.00, 16.33, 1, 87.33, , 
6670379432, NTY4MDI3MDMzNDo5NDgwNjgxNDk4MQ--, Pasadena| Pasadena, complimentary breakfast|pool(s)|laundry facilities, 2.5, 58.00, 13.40, 1, 71.40, , 
6706408171, NTY4MDI3MDMzNDo5NDgwNjgxNDk3Ng--, Glendale - Burbank - Universal City| Burbank, airport shuttle|pool(s)|restaurant(s), 2.0, 51.00, 11.58, 1, 62.58, , 
6480251925, NTY4MDI3MDMzNDo5NDgwNjgxMzM4OQ--, Downey - Commerce - Norwalk| Downey, complimentary breakfast|fitness center|pool(s)|laundry facilities|high-speed internet access, 2.5, 54.00, 10.84, 1, 64.84, , 
5086161081, NTY4MDI3MDMzNDo5NDgwNjgxMzM5NQ--, Inglewood| Inglewood, complimentary breakfast|high-speed internet access, 2.0, 51.00, 13.41, 1, 64.41, , 
5343557256, NTY4MDI3MDMzNDo5NDgwNjgxNDk3OQ--, Mid-Wilshire - Westlake - USC| Los Angeles, fitness center|pool(s)|restaurant(s)|business center|high-speed internet access, 3.0, 84.00, 19.23, 1, 103.23, , 
6093662911, NTY4MDI3MDMzNDo5NDgwNjgxNDk4Mw--, Beverly Hills - West Hollywood| Beverly Hills, suite|fitness center|pool(s)|restaurant(s)|laundry facilities|high-speed internet access|kitchenette, 3.5, 132.00, 26.05, 1, 158.05, , 
5467919954, NTY4MDI3MDMzNDo5NDgwNjgxNDk2Mg--, Glendale - Burbank - Universal City| Burbank, complimentary breakfast, 2.5, 71.00, 13.69, 1, 84.69, , 
5870162792, NTY4MDI3MDMzNDo5NDgwNjgxNDk2OQ--, Pasadena| Pasadena, smoke free rooms|fitness center|pool(s)|restaurant(s)|business center|laundry facilities|high-speed internet access|tennis nearby, 3.0, 87.00, 20.33, 1, 107.33, , 
5031844253, NTY4MDI3MDMzNDo5NDgwNjgxMzM5Nw--, Culver City| Culver City, laundry facilities|high-speed internet access, 2.0, 53.00, 13.76, 1, 66.76, , 
5079885110, NTY4MDI3MDMzNDo5NDgwNjgxNDk5MQ--, El Monte - Rosemead - Monterey Park| Rosemead, pool(s)|high-speed internet access, 2.0, 50.00, 11.40, 1, 61.40, , 
5806543994, NTY4MDI3MDMzNDo5NDgwNjgxNDk4Mg--, Beverly Hills - West Hollywood| Beverly Hills, fitness center|restaurant(s)|business center, 3.0, 123.00, 24.87, 1, 147.87, , 
5540188297, NTY4MDI3MDMzNDo5NDgwNjgxNDk2MQ--, Hawthorne| Hawthorne, fitness center|pool(s)|high-speed internet access, 2.5, 66.00, 15.62, 1, 81.62, , 
5877525305, NTY4MDI3MDMzNDo5NDgwNjgxNDk5NQ--, El Monte - Rosemead - Monterey Park| Rosemead, , 2.5, 66.00, 13.13, 1, 79.14, , 
6047348158, NTY4MDI3MDMzNDo5NDgwNjgxNDk1Ng--, Hollywood| Hollywood, complimentary breakfast, 1.0, 54.00, 13.76, 1, 67.76, , 
6467232559, NTY4MDI3MDMzNDo5NDgwNjgxNDk1NA--, Hawthorne| Hawthorne, airport shuttle|complimentary breakfast|pool(s)|business center|laundry facilities|high-speed internet access|kitchenette, 2.0, 59.00, 14.54, 1, 73.54, , 
5273135657, NTY4MDI3MDMzNDo5NDgwNjgxMzM5NA--, Century City - Westwood| Century City, smoke free rooms|complimentary breakfast|fitness center|business center|laundry facilities|high-speed internet access, 2.5, 87.00, 19.67, 1, 106.67, , 
