Days Inn Convention Center|Orlando,Ramada Inn Convention Center Orlando,0.888888888889
Extended StayAmerica Convention Center Westwood Blvd|Orlando,Extended Stay America Hotel Westwood Orlando,0.722891566265
Orlando Metropolitan Resort|Orlando,Metropolitan Resort Orlando,1.0
Ramada Convention Center IDrive|Orlando,Ramada Inn Convention Center Orlando,0.813559322034
Imperial Swan Hotel and Suites|Orlando,Imperial Swan Hotel & Suites Orlando,0.954545454545
Crowne Plaza Universal|Orlando,Crowne Plaza Hotel Universal Orlando,0.977777777778
Doubletree Orlando Universal|Orlando,Doubletree Hotel Universal Orlando,1.0
Embassy Suites IDrive Convention Center|Orlando,Hawthorn Suites Convention Center Orlando,0.722222222222
Four Points Studio City|Orlando,Four Points Hotel Studio City Orlando,0.978723404255
Hyatt Place Universal|Orlando,Hyatt Place Hotel Universal Orlando,0.976744186047
Residence Inn Canada Ave|Orlando,Residence Inn International Drive Orlando,0.701754385965
Hampton Inn IDrive North|Orlando,Hampton Inn Universal Orlando,0.711111111111
International Palms Resort|Orlando,International Palms Resort Orlando,1.0
Orlando Metropolitian Express|Orlando,Metropolitan Express Hotel Orlando,0.975609756098
Extended StayAmerica Universal Major Blvd|Orlando,Extended Stay America Hotel Universal Studios Orlando,0.79012345679
Extended Stay Deluxe Vineland Road|Orlando,Extended Stay Deluxe Hotel Maitland Summit Orlando,0.760563380282
Four Points Chateau Elan|Sebring,Four Points Hotel Chateau Elan Sebring,0.979591836735
Residence Inn|Massachusetts Southeast Suburbs,Residence Inn Boston Cambridge (Massachusetts),0.787878787879
Marriott Monterey|Monterey,Marriott Hotel Monterey,1.0
Casa Munras|Monterey,Casa Munras Hotel Monterey,1.0
Hyatt Regency Monterey|Monterey,Hyatt Regency Hotel Monterey,1.0
Portola Hotel and Spa at Monterey Bay|Monterey,Portola Hotel & Spa at Monterey Bay,0.952380952381
Hilton Garden Inn a Hilton|Monterey,Hilton Garden Inn Monterey,0.790697674419
Hotel Abrego|Monterey,Hotel Abrego Monterey,1.0
Best Western Park Crest Inn|Monterey,Best Western Park Crest Inn Monterey,1.0
Best Western Victorian Inn|Monterey,Best Western Victorian Inn Monterey,1.0
Ramada Limited Monterey|Monterey,Ramada Limited Hotel Monterey,1.0
Vagabond Inn|Monterey,Vagabond Inn Monterey,1.0
Best Western Mission Inn|Monterey,Best Western Ramona Inn Monterey,0.851063829787
Best Western Beach Dunes Inn|Monterey,Best Western Beach Resort Monterey,0.792452830189
Holiday Inn University Plaza|Bowling Green,Holiday Inn University Plaza Bowling Green (Kentucky),0.823529411765
Holiday Inn Express and Suites|North Platte,Holiday Inn Express Hotel & Suites North Platte,0.945454545455
Country Inn and Suites|Owatonna,Country Inn & Suites Owatonna,0.947368421053
Extended StayAmerica Roseville|Roseville,Extended Stay America Hotel Detroit Roseville (Michigan),0.8
Holiday Inn Airport|Birmingham,Holiday Inn Airport Birmingham (Alabama),1.0
Courtyard Colonnade|Birmingham,Courtyard Hotel Colonnade Birmingham (Alabama),0.974358974359
Hilton Perimeter|Birmingham,Hilton Hotel Perimeter Park Birmingham (Alabama),0.842105263158
Residence Inn|Birmingham,Residence Inn Inverness Birmingham (Alabama),0.722222222222
Residence Inn|Birmingham,Residence Inn Inverness Birmingham (Alabama),0.722222222222
Holiday Inn|Birmingham,Days Inn Birmingham (Alabama),0.736842105263
Lakeview Resort And Spa|Morgantown,Lakeview Golf Resort Morgantown (West Virginia),0.769230769231
Renaissance|Oklahoma City,Renaissance Hotel Oklahoma City,1.0
Sheraton|Oklahoma City,Sheraton Hotel Oklahoma City,1.0
Residence Inn|Oklahoma City,Residence Inn West Oklahoma City,0.838709677419
Courtyard Airport|Oklahoma City,Courtyard Hotel Airport Oklahoma City,0.971428571429
Four Points|Oklahoma City,Four Points Hotel Oklahoma City,1.0
Hyatt Place|Oklahoma City,Hyatt Place Hotel Airport Oklahoma City,0.709677419355
Wyndham Garden Hotel|Oklahoma City,Wyndham Garden Hotel Airport Oklahoma City,0.756756756757
Residence Inn West|Oklahoma City,Residence Inn West Oklahoma City,1.0
Baymont Inn South|Oklahoma City,Baymont Inn & Suites South Oklahoma City,0.790697674419
Candlewood Suites|Oklahoma City,Candlewood Suites Oklahoma City,1.0
Days Inn South|Oklahoma City,Days Inn South Oklahoma City,1.0
Extended Stay America Airport|Oklahoma City,Extended Stay America Hotel Airport Oklahoma City,0.983050847458
Howard Johnson|Oklahoma City,Howard Johnson Inn Oklahoma City,0.875
Baymont Suites South|Oklahoma City,Baymont Inn & Suites South Oklahoma City,0.869565217391
Fairfield Inn and Suites|Oklahoma City,Fairfield Inn & Suites Airport Oklahoma City,0.8
Marriott Waterford|Oklahoma City,Marriott Hotel Waterford Oklahoma City,0.972972972973
Courtyard|Oklahoma City,Courtyard Hotel North Oklahoma City,0.72
Crowne Plaza|Oklahoma City,Crowne Plaza Hotel Oklahoma City,1.0
Country Inn and Suites|Oklahoma City,Country Inn & Suites North Oklahoma City,0.818181818182
Extended StayAmerica NW Expressway|Oklahoma City,Extended Stay America Hotel Airport Oklahoma City,0.75
Courtyard North|Oklahoma City,Courtyard Hotel North Oklahoma City,0.967741935484
Springhill Suites|Oklahoma City,SpringHill Suites Airport Oklahoma City,0.809523809524
Best Western Palm Aire|Weslaco,Best Western Palm Aire Hotel and Suites Weslaco,0.846153846154
Microtel Inn and Suites|Sandusky,Fairfield Inn & Suites Sandusky,0.731707317073
Americas Best Value Inn|Sandusky,Americas Best Value Inn Lake Erie Sandusky,0.821428571429
Quality Inn Cedar Point South|Sandusky,Rodeway Inn Cedar Point South Sandusky,0.827586206897
Best Western|Hurricane,Best Western Hotel Hurricane Mills,1.0
Holiday Inn Express|Plainfield,Holiday Inn Express Plainfield (Indiana),1.0
Days Inn|Lake Havasu,Days Inn Lake Havasu City,1.0
Country Inn and Suites|hot Springs,Country Inn & Suites Hot Springs (Arkansas),0.72
Doubletree|Syracuse,Doubletree Hotel East Syracuse,1.0
Quality Inn|Syracuse,Quality Inn East Syracuse,1.0
DoubleTree Club|Syracuse,Doubletree Hotel East Syracuse,0.8
Comfort Inn and Suites Airport not yet reported|Syracuse,Comfort Inn & Suites Airport Syracuse (New York),0.771084337349
Best Western Grace Inn Liverpool|Syracuse,Best Western Inn Airport North Syracuse,0.75
Sheraton University|Syracuse,Sheraton Syracuse University Hotel (New York),0.745098039216
Microtel Inn and Suites|Holland,Microtel Inn & Suites Holland (Michigan),0.95
Country Inn and Suites|Tuscaloosa,Country Inn & Suites Tuscaloosa,0.947368421053
La Quinta|Tuscaloosa,La Quinta Inn Tuscaloosa,0.818181818182
Courtyard by Marriott|Phoenix,Courtyard Hotel Airport Phoenix,0.769230769231
Crowne Plaza|Phoenix,Crowne Plaza Hotel Phoenix,1.0
Holiday Inn Select|Phoenix,Holiday Inn West Phoenix,0.823529411765
Embassy Suites Airport|Phoenix,Embassy Suites Airport Phoenix,1.0
Hilton Airport|Phoenix,Hilton Hotel Airport Phoenix,0.965517241379
Radisson Airport University St|Phoenix,Radisson Hotel Airport North Phoenix,0.754716981132
Radisson Airport North North St|Phoenix,Radisson Hotel Airport North Phoenix,0.814814814815
Residence Inn|Phoenix,Residence Inn Phoenix,1.0
Extended StayAmerica East Oak|Phoenix,Extended Stay America Hotel Airport East Oak Phoenix,0.852941176471
Courtyard Chandler|Phoenix,Courtyard Hotel Avondale West Phoenix,0.714285714286
Hyatt Place Gilbert|Phoenix,Hyatt Place Hotel North Phoenix,0.756756756757
Hawthorn Suites|Phoenix,Hilton Suites Phoenix,0.785714285714
Country Inn and Suites|Phoenix,A Victory Inn and Suites Phoenix,0.789473684211
Wyndham|Phoenix,Wyndham Hotel Phoenix,1.0
Clarendon Hotel and Suites|Phoenix,Candlewood Suites Phoenix,0.705882352941
Courtyard Camelback|Phoenix,Courtyard Hotel Camelback Phoenix,0.974358974359
Embassy Suites Biltmore|Phoenix,Embassy Suites Biltmore Phoenix,1.0
Hilton Garden Inn Midtown|Phoenix,Hilton Garden Inn Midtown Phoenix,1.0
Hilton Suites|Phoenix,Hilton Suites Phoenix,1.0
Holiday Inn Midtown|Phoenix,Holiday Inn Downtown Phoenix,0.871794871795
Hotel San Carlos|Phoenix,Hotel San Carlos Phoenix,1.0
Extended Stay Deluxe Midtown|Phoenix,Extended Stay Deluxe Hotel Midtown Phoenix,0.982456140351
Extended Stay Deluxe Biltmore|Phoenix,Extended Stay Deluxe Hotel Biltmore Phoenix,0.983050847458
Springhill Suites|Phoenix,SpringHill Suites Downtown Phoenix,0.790697674419
Courtyard WestAvondale|Phoenix,Courtyard Hotel Avondale West Phoenix,0.782608695652
Hampton Inn|Phoenix,Hampton Inn Phoenix,1.0
Residence Inn Phoenix NorthHappy Valley|Phoenix,Residence Inn North Phoenix,0.745098039216
Sheraton Crescent|Phoenix,Sheraton Crescent Hotel Phoenix,1.0
Crowne Plaza|Phoenix,Crowne Plaza Hotel Phoenix,1.0
Four Points Barcelo|Phoenix,Four Points Hotel North Phoenix,0.702702702703
Hyatt Place North|Phoenix,Hyatt Place Hotel North Phoenix,0.971428571429
Residence Inn|Phoenix,Residence Inn Phoenix,1.0
Homewood Suites Metro Center|Phoenix,Homewood Suites Metro Center Phoenix,1.0
Resort JW Marriott Desert Ridge|Phoenix,JW Marriott Desert Ridge Resort Phoenix,0.774193548387
Resort Pointe Hilton Squaw Peak|Phoenix,Pointe Hilton Squaw Peak Resort Phoenix,0.774193548387
Resort Pointe Hilton Tapatio Cliffs Resort|Phoenix,Pointe Hilton Tapatio Cliffs Resort Phoenix,0.909090909091
Courtyard Scottsdale North|Phoenix,Courtyard Hotel North Phoenix,0.761904761905
Springhill Suites|Phoenix,SpringHill Suites Downtown Phoenix,0.790697674419
Extended Stay Deluxe|Phoenix,Extended Stay Deluxe Hotel Midtown Phoenix,0.816326530612
Courtyard Old Town|Phoenix,Courtyard Hotel North Phoenix,0.705882352941
Hyatt Place|Phoenix,Hyatt Place Hotel North Phoenix,0.758620689655
Legacy Golf Resort|Phoenix,Legacy Golf Resort Phoenix,1.0
Sheraton TempePhoenix Airport|Phoenix,Hilton Hotel Airport Phoenix,0.702702702703
Amerisuites Phoenix Airport|Phoenix,Embassy Suites Airport Phoenix,0.714285714286
Courtyard Downtown|Phoenix,Courtyard Hotel North Phoenix,0.705882352941
Residence Inn|Phoenix,Residence Inn Phoenix,1.0
Towneplace Suites Tempe|Phoenix,TownePlace Suites Metrocenter Mall Phoenix,0.736842105263
Holiday Inn West|Phoenix,Holiday Inn West Phoenix,1.0
Courtyard by Marriott|Phoenix,Courtyard Hotel Airport Phoenix,0.769230769231
Hilton Phoenix East Mesa|Phoenix,Hilton Suites Phoenix,0.733333333333
Holiday Inn|Phoenix,Holiday Inn West Phoenix,0.814814814815
Residence Inn|Phoenix,Residence Inn Phoenix,1.0
Extended StayAmerica Mesa|Phoenix,Extended Stay America Hotel Phoenix,0.869565217391
Homestead Studio Suites|Phoenix,Homestead Studio Suites North Metro Phoenix,0.793103448276
Residence Inn|Hartford,Residence Inn Downtown Hartford,0.742857142857
Days Inn|Hartford,Holiday Inn East Hartford,0.736842105263
Crowne Plaza|Hartford,Crowne Plaza Hotel Downtown Hartford,0.705882352941
Hilton|Hartford,Hilton Hotel Hartford,1.0
Residence Inn|Hartford,Residence Inn Downtown Hartford,0.742857142857
Holiday Inn Express|Hartford,Holiday Inn Express Downtown Hartford,0.808510638298
Sheraton|Hartford,Sheraton Hotel East Hartford,1.0
Holiday Inn|Hartford,Holiday Inn East Hartford,1.0
Marriott Farmington|Hartford,Marriott Hotel Downtown Hartford,0.702702702703
Holiday Inn|Joliet,Holiday Inn Joliet,1.0
Wingate Inn|Joliet,Wingate Inn Joliet,1.0
Courtyard|Sioux Falls,Courtyard Hotel Sioux Falls,1.0
Sheraton Sioux Falls|Sioux Falls,Sheraton Hotel Sioux Falls,1.0
Holiday Inn Express|Sioux Falls,Holiday Inn Sioux Falls,0.733333333333
Quality Inn And Suites|Sioux Falls,Quality Inn And Suites Sioux Falls,1.0
Springhill Suites|Sioux Falls,SpringHill Suites Sioux Falls,1.0
Fairfield Inn|Sioux Falls,Fairfield Inn Sioux Falls,1.0
La Quinta|Chattanooga,La Quinta Inn Chattanooga,0.818181818182
Extended StayAmerica|Chattanooga,Extended Stay America Hotel Chattanooga,0.975609756098
Courtyard|Chattanooga,Courtyard Hotel Chattanooga,1.0
Sheraton Read House|Chattanooga,Sheraton Read House Hotel Chattanooga,1.0
Staybridge Suites|Chattanooga,Staybridge Suites Downtown Chattanooga,0.790697674419
Chattanooga Choo Choo|Chattanooga,Chattanooga Choo Choo Hotel,1.0
Country Inn and Suites|Chattanooga,Country Suites Chattanooga,0.875
Country Inn and Suites|Chattanooga,Country Suites Chattanooga,0.875
Fairfield Inn and Suites|Chattanooga,Fairfield Inn Chattanooga,0.787878787879
Sheraton|Duluth,Sheraton Hotel Duluth (Minnesota),1.0
Fairfield Inn|Duluth,Fairfield Inn Duluth (Minnesota),1.0
Days Inn|Duluth,Days Inn Duluth (Minnesota),1.0
Best Western Downtown|Duluth,Best Western Downtown Motel Duluth (Minnesota),0.875
Hilton Garden Inn|Minneapolis-St. Paul,Hilton Garden Inn Downtown Minneapolis,0.790697674419
Hilton Garden Inn|Minneapolis-St. Paul,Hilton Garden Inn Downtown Minneapolis,0.790697674419
Holiday Inn Metrodome|Minneapolis-St. Paul,Holiday Inn Metrodome Minneapolis,1.0
Radisson|Minneapolis-St. Paul,Radisson Plaza Hotel Minneapolis,0.727272727273
Ramada Plaza|Minneapolis-St. Paul,Ramada Plaza Hotel Minneapolis,1.0
DoubleTree Park Place St Louis Park|Minneapolis-St. Paul,Doubletree Hotel Park Place Minneapolis,0.736842105263
Holiday Inn Express Golden Valley|Minneapolis-St. Paul,Holiday Inn Express Hotel & Suites Golden Valley Minneapolis,0.868421052632
Towneplace Suites St Louis Park|Minneapolis-St. Paul,Towneplace Suites Downtown Minneapolis,0.701754385965
Holiday Inn Express|Tombstone,Holiday Inn Express Tombstone,1.0
Holiday Inn Express|Howell,Holiday Inn Express Hotel & Suites Howell,0.791666666667
Doubletree Commerce|Los Angeles - San Gabriel Valley,Doubletree Hotel Commerce Los Angeles,0.974358974359
Best Western Markland|Los Angeles - San Gabriel Valley,Best Western Mikado Hotel Los Angeles,0.85
Best Western Montebello|Los Angeles - San Gabriel Valley,Best Western Mikado Hotel Los Angeles,0.714285714286
Days Inn|Los Angeles - San Gabriel Valley,Rodeway Inn Los Angeles,0.736842105263
Best Western Markland|Los Angeles - San Gabriel Valley,Best Western Mikado Hotel Los Angeles,0.85
Extended StayAmerica Arcadia|Los Angeles - San Gabriel Valley,Extended Stay America Hotel Los Angeles,0.816326530612
Westin|Los Angeles - San Gabriel Valley,Westin Hotel LAX Los Angeles,0.705882352941
Hampton Inn|Poughkeepsie - Fishkill,Hampton Inn Fishkill,1.0
Holiday Inn|Poughkeepsie - Fishkill,Holiday Inn Fishkill,1.0
Holiday Inn Kingston|Poughkeepsie - Fishkill,Holiday Inn Fishkill,0.709677419355
Days Inn|Poughkeepsie - Fishkill,Days Inn Poughkeepsie,1.0
Staybridge Suites|Tallahassee,Staybridge Suites East Tallahassee,0.871794871795
Holiday Inn Hotel and Suites|Tallahassee,Holiday Inn Hotel & Suites North Tallahassee,0.826086956522
Four Points|Tallahassee,Four Points Hotel North Tallahassee,0.758620689655
Comfort Inn|Tallahassee,Comfort Inn Tallahassee,1.0
Towneplace Suites|Tallahassee,TownePlace Suites Tallahassee,1.0
Doubletree|Tallahassee,Doubletree Hotel Tallahassee,1.0
Residence Inn Universities at the Capitol|Tallahassee,Residence Inn Universities Capitol Tallahassee,0.906666666667
Holiday Inn Capitol East|Tallahassee,Holiday Inn Capitol East Tallahassee,1.0
Red Lion|Port Angeles,Red Lion Hotel Port Angeles,1.0
Radisson|Utica - Rome,Radisson Hotel Utica (New York),1.0
Residence Inn Salinas Monterey|Salinas,Residence Inn Salinas,0.722222222222
Holiday Inn Express|Salinas,Holiday Inn Express Hotel & Suites Salinas,0.791666666667
Best Western SalinasMonterey|Salinas,Best Western Monterey Hotel Salinas,1.0
Holiday Inn|Portsmouth - Kittery,Holiday Inn Portsmouth (New Hampshire),1.0
Anchorage Inn and Suites|Portsmouth - Kittery,Anchorage Inn & Suites Portsmouth (New Hampshire),0.952380952381
Fairfield Inn|Portsmouth - Kittery,Fairfield Inn Seacoast Portsmouth (New Hampshire),0.742857142857
Comfort Inn|Portsmouth - Kittery,Comfort Inn Portsmouth (New Hampshire),1.0
La Quinta Inn|Cocoa Beach - Merritt Island,La Quinta Inn Cocoa Beach,1.0
International Palms Resort|Cocoa Beach - Merritt Island,International Palms Resort Cocoa Beach,1.0
Holiday Inn|Cocoa Beach - Merritt Island,Days Inn Cocoa Beach,0.736842105263
Holiday Inn Express Suites Algonquin|Chicago Suburbs,Holiday Inn Express Hotel & Suites Midway Airport Chicago,0.725
Holiday Inn|Chicago Suburbs,Midway Inn Chicago,0.761904761905
Hilton|Chicago Suburbs,Hilton Hotel Chicago,1.0
Renaissance|Chicago Suburbs,Renaissance Suites Hotel Chicago,0.758620689655
Embassy Suites|Chicago Suburbs,Embassy Suites Downtown Chicago,0.756756756757
Hilton Suites|Chicago Suburbs,City Suites Hotel Chicago,0.75
Hyatt Regency Woodfield|Chicago Suburbs,Hyatt Regency Hotel Chicago,0.722222222222
Renaissance|Chicago Suburbs,Renaissance Suites Hotel Chicago,0.758620689655
Best Western Golden Spike|The Black Hills,Best Western Adena Inn Chillicothe (Ohio),0.765957446809
Country Inn and Suites|The Black Hills,Country Inn & Suites Athens (Georgia),0.947368421053
La Quinta Inn and Suites|The Black Hills,La Quinta Inn & Suites Weatherford (Texas),0.952380952381
Americas Best Value Inn|The Black Hills,Americas Best Value Inn Athens (Tennessee),1.0
Best Western Town and Country|The Black Hills,Best Western Inn Hillsboro (Texas),0.731707317073
Quality Inn|The Black Hills,Quality Inn Hillsville,1.0
Holiday Inn|The Black Hills,Holiday Inn Athens (Georgia),1.0
Howard Johnson Express|The Black Hills,Howard Johnson Express Inn Ruther Glen,0.916666666667
Super|The Black Hills,Super 8 Estherville,0.833333333333
Holiday Inn Select University Parkway|Winston Salem,Holiday Inn Select University Parkway Winston Salem,1.0
Marriott|Winston Salem,Marriott Hotel Winston Salem,1.0
La Quinta Inn|Winston Salem,La Quinta Inn & Suites Winston Salem,0.742857142857
Holiday Inn Hanes Mall|Winston Salem,Days Inn Hanes Mall Winston Salem,0.878048780488
Hotel Palomar|Arlington,Hotel Palomar Arlington (Virginia),1.0
Hyatt Arlington|Arlington,Hyatt Hotel Arlington (Virginia),1.0
Westin Arlington Gateway|Arlington,Westin Gateway Hotel Arlington (Virginia),0.965517241379
Marriott Key Bridge|Arlington,Marriott Hotel Key Bridge Arlington (Virginia),0.974358974359
Sheraton National|Arlington,Sheraton National Hotel Arlington (Virginia),1.0
Courtyard|Arlington,Courtyard Hotel Arlington (Texas),1.0
Hilton Arlington|Arlington,Hilton Hotel Arlington (Texas),1.0
Holiday Inn Arlington at Ballston|Arlington,Holiday Inn Ballston Arlington (Virginia),0.909090909091
Best Western RosslynIwo Jima|Arlington,Best Western Hotel Rosslyn Arlington (Virginia),0.816326530612
Holiday Inn Express|North East,Holiday Inn Express Hotel & Suites North East (Maryland),0.791666666667
Holiday Inn Plainview|Long Island - Nassau,Holiday Inn Quad Cities Rock Island,0.727272727273
Country Inn and Suites East|St. Cloud,Country Inn & Suites East Saint Cloud,0.958333333333
Best Western|St. Cloud,Best Western Kelly Inn Saint Cloud,0.705882352941
Fairfield Inn|St. Cloud,Fairfield Inn Saint Cloud,1.0
Meritage Resort and Spa|Napa - Sonoma,Meritage Resort Napa,0.882352941176
Vino Bello Resort|Napa - Sonoma,Vino Bello Resort Napa,1.0
Marriott|Napa - Sonoma,Marriott Hotel Napa,1.0
River Terrace Inn|Napa - Sonoma,River Terrace Inn Napa,1.0
Embassy Suites|Napa - Sonoma,Embassy Suites Valley Napa,0.8
Hawthorne Inn and Suites|Napa - Sonoma,Hawthorn Suites Napa,0.857142857143
Travelodge|Napa - Sonoma,Travelodge Hotel Napa,1.0
MacArthur Place|Napa - Sonoma,Macarthur Place Inn Sonoma,0.882352941176
Courtyard North|Charlottesville,Courtyard Hotel North Charlottesville,0.967741935484
Doubletree|Charlottesville,Doubletree Hotel Charlottesville,1.0
Omni Charlottesville Hotel|Charlottesville,Omni Hotel Charlottesville,1.0
Residence Inn|Charlottesville,Residence Inn Charlottesville,1.0
Comfort Inn Monticello|Charlottesville,Comfort Inn Monticello Charlottesville,1.0
Courtyard University Medical Center|Charlottesville,Courtyard Hotel University Medical Center Charlottesville,0.985915492958
Holiday Inn University Area|Charlottesville,Holiday Inn University Charlottesville,0.897959183673
Fairfield Inn|Charlottesville,Fairfield Inn Charlottesville,1.0
Red Roof Inn|Charlottesville,Red Roof Inn Charlottesville,1.0
Park Inn|Brunswick,Parkwood Inn Brunswick (Maine),0.8
Hampton Inn|Brunswick,Hampton Inn North Brunswick,1.0
Jameson Inn|Brunswick,Hampton Inn North Brunswick,0.727272727273
Ramada Inn|Brunswick,Ramada Inn Brunswick,1.0
Hyatt Regency|Crystal City,Hyatt Regency Hotel Hudson Jersey City,0.764705882353
Sheraton Crystal City|Crystal City,Sheraton Hotel Salt Lake City,1.0
Courtyard Crystal City|Crystal City,Courtyard Hotel Johnson City (Tennessee),1.0
Crowne Plaza National Airport|Crystal City,Crowne Plaza Hotel LaGuardia Airport New York City,0.8
Embassy Suites Crystal CityAirport|Crystal City,Embassy Suites Airport Oklahoma City,1.0
Hilton Crystal City|Crystal City,Hilton Hotel New York City,1.0
Hilton Crystal City National Airport|Crystal City,Hilton Hotel Airport Salt Lake City,0.769230769231
Holiday Inn National Airport Crystal City|Crystal City,Holiday Inn Airport Oklahoma City,0.808510638298
Marriott Crystal City at Reagan National Airport|Crystal City,Marriott Hotel LaGuardia Airport New York City,0.730158730159
Hilton|Baltimore South,Hilton Hotel Baltimore,1.0
Sheraton|Baltimore South,Sheraton Beach Hotel South Padre Island,0.727272727273
La Quinta Inn and Suites|Baltimore South,La Quinta Inn & Suites South Padre Island,0.952380952381
Extended StayAmerica|Baltimore South,Extended Stay America Hotel Mount Pleasant (South Carolina),0.975609756098
Courtyard Marriott|Baltimore South,Courtyard Hotel Airport South Portland,0.777777777778
Hilton Garden Inn Arundel Mill|Baltimore South,Hilton Garden Inn Detroit Southfield,0.763636363636
Courtyard|Fort Wayne,Courtyard Hotel Fort Wayne,1.0
Holiday Inn Hotel and Suites|Fort Wayne,Holiday Inn Express Hotel & Suites Fort Wayne,0.791666666667
Comfort Suites|Fort Wayne,Comfort Suites Fort Wayne,1.0
Holiday Inn|Wilsonville,Holiday Inn Portland Wilsonville,0.709677419355
Days Inn|Blythe,Days Inn Blythe,1.0
Best Western|Pinetop,Best Western Inn of Pinetop,0.774193548387
Radisson Paper Valley Hotel|Greenbay-Appleton,Radisson Paper Valley Hotel Appleton (Wisconsin),0.75
La Quinta Inn and Suites|Greenbay-Appleton,La Quinta Inn And Suites Appleton (Wisconsin),0.754716981132
Extended StayAmerica Appleton|Greenbay-Appleton,Extended Stay America Hotel Appleton (Wisconsin),0.71875
Holiday Inn|Mobile,Holiday Inn Downtown Mobile,0.709677419355
Radisson Admiral Semmes|Mobile,Radisson Admiral Semmes Hotel Mobile,1.0
Courtyard|Mobile,Courtyard Hotel Mobile,1.0
Residence Inn|Mobile,Residence Inn Mobile,1.0
Baymont Inn and Suites|Mobile,Baymont Inn & Suites Mobile,0.947368421053
La Quinta|Mobile,La Quinta Inn Mobile,0.818181818182
Townplace Suites|Mobile,Towneplace Suites Mobile,0.969696969697
Holiday Inn|Augusta,Holiday Inn Augusta (Maine),1.0
Days Inn Wheeler Road|Augusta,Days Inn Wheeler Road Augusta,1.0
Country Inn and Suites|Kenosha,Country Inn & Suites Kenosha,0.947368421053
Country Inn and Suites|Savannah,Country Inn & Suites Midtown Savannah,0.782608695652
Days Inn|Savannah,Days Inn Savannah (Tennessee),1.0
La Quinta Inn I|Savannah,La Quinta Inn Savannah (Georgia),0.769230769231
Mansion On Forsyth Park|Savannah,Mansion On Forsyth Park Hotel Savannah (Georgia),0.793103448276
Marriott Riverfront|Savannah,Marriott Hotel Riverfront Savannah (Georgia),0.76
River Street Inn|Savannah,River Street Inn Savannah (Georgia),0.744186046512
Best Western Promenade|Savannah,Best Western Promenade Hotel Savannah (Georgia),0.785714285714
Springhill Suites Downtown|Savannah,SpringHill Suites Downtown Savannah (Georgia),0.825396825397
Courtyard Midtown|Savannah,Courtyard Hotel Midtown Savannah (Georgia),0.739130434783
Residence Inn Midtown|Savannah,Residence Inn Midtown Savannah (Georgia),0.792452830189
Holiday Inn|Savannah,Days Inn Savannah (Tennessee),0.736842105263
Days Inn Holbrook|Holbrook,Days Inn Holbrook,1.0
Renaissance Casa de Palmas|McAllen,Renaissance Hotel Casa de Palmas McAllen,0.981132075472
Holiday Inn Toms River|Toms River,Holiday Inn Toms River,1.0
La Quinta|San Angelo,La Quinta Inn San Angelo,0.818181818182
Residence Inn|Detroit Northwest,Residence Inn Dearborn Detroit,0.742857142857
Hilton Garden Inn|Detroit Northwest,Hilton Garden Inn Downtown Detroit,0.790697674419
Residence Inn|Detroit Northwest,Residence Inn Dearborn Detroit,0.742857142857
Holiday Inn|Newport News - Hampton,Days Inn Newport News,0.736842105263
Springhill Suites|Newport News - Hampton,Springhill Suites Hampton (Virginia),0.739130434783
Suburban Extended Stay Lodge|Newport News - Hampton,Suburban Extended Stay Hotel Hampton (Virginia),0.761904761905
Marriott at City Center|Newport News - Hampton,Marriott Hotel City Center Newport News,0.954545454545
Courtyard|Newport News - Hampton,Courtyard Hotel Hampton,1.0
Crestwood Suites|Newport News - Hampton,Crestwood Suites Newport News,1.0
Extended Stay America|Newport News - Hampton,Extended Stay America Hotel Newport News,1.0
Fairfield Inn|Cookeville,Fairfield Inn & Suites Cookeville,0.742857142857
Holiday Inn Express|Petersburg,Holiday Inn Express Hotel & Suites Petersburg,0.791666666667
Fairfield Inn|Peru,Fairfield Inn Peru,1.0
Extended StayAmerica|Laredo,Extended Stay America Hotel Del Mar Laredo,0.8
La Quinta|Nacogdoches,La Quinta Inn Nacogdoches,0.818181818182
Comfort Inn|Dubuque,Comfort Inn Dubuque,1.0
Fairfield Inn|Dubuque,Fairfield Inn Dubuque,1.0
Holiday Inn|Dubuque,Holiday Inn Galena Dubuque,0.758620689655
Crowne Plaza|Boston North Shore,Crowne Plaza Hotel Chicago Northbrook,0.727272727273
Residence Inn|Boston North Shore,Residence Inn North Conway,1.0
Springhill Suites|Boston North Shore,SpringHill Suites North Charleston,1.0
Extended StayAmerica|Boston North Shore,Extended Stay America Hotel North Charleston,0.975609756098
Hampton Inn Peabody|Boston North Shore,Hampton Inn Speedway North Las Vegas,0.820512820513
